{
  "catalog_version": "1.0",
  "kernel_baseline": "1.8",
  "capsule_schema_version": "v3.11",
  "canonical_source": "kernel/modules/20-capsule-schema.md",
  "field_count": 43,
  "fields": [
    {
      "ordinal": 1,
      "id": "user_intent",
      "label": "User Intent",
      "occurrence": 1,
      "group": "causal_entry",
      "purpose": "Preserve what the user actually requested before intent resolution.",
      "owner": "Capsule intake",
      "lifecycle": "pre_open",
      "source": "Current user trigger",
      "grammar": "Verbatim text or a close, meaning-preserving paraphrase.",
      "cardinality": "Exactly one value.",
      "verification": "The user is authoritative for the content of their request; structural presence is mandatory.",
      "mutability": "Captured once before reasoning and immutable after capsule open.",
      "hash_inclusion": true,
      "failure_condition": "Missing or materially altered intent blocks schema compliance.",
      "display": "Internal unless capsule state is explicitly requested.",
      "introduced": "v3.3",
      "last_changed": "v3.3",
      "superseded": null,
      "examples": { "valid": "Review the repository and propose a slim boot plan.", "invalid": "Improve things." }
    },
    {
      "ordinal": 2,
      "id": "causal_id",
      "label": "Causal ID",
      "occurrence": 1,
      "group": "causal_entry",
      "purpose": "Bind the capsule to a normalized triggering input.",
      "owner": "Capsule intake",
      "lifecycle": "pre_open",
      "source": "Normalized Trigger field",
      "grammar": "SHA-256 digest of the normalized trigger.",
      "cardinality": "Exactly one 64-character hexadecimal digest.",
      "verification": "Recompute from the normalized trigger and require an exact match.",
      "mutability": "Immutable after computation.",
      "hash_inclusion": true,
      "failure_condition": "Absent, malformed, or mismatched digest blocks capsule opening.",
      "display": "Internal unless capsule state is explicitly requested.",
      "introduced": "v3.3",
      "last_changed": "v3.3",
      "superseded": null
    },
    {
      "ordinal": 3,
      "id": "trigger",
      "label": "Trigger",
      "occurrence": 1,
      "group": "causal_entry",
      "purpose": "Store the normalized input used for causal identity and routing.",
      "owner": "Capsule intake",
      "lifecycle": "pre_open",
      "source": "Current user input or governed kernel event",
      "grammar": "Normalized, meaning-preserving trigger text.",
      "cardinality": "Exactly one value.",
      "verification": "Must preserve the actionable meaning of User Intent.",
      "mutability": "Immutable after Causal ID computation.",
      "hash_inclusion": true,
      "failure_condition": "Missing trigger or mismatch with Causal ID blocks opening.",
      "display": "Internal unless capsule state is explicitly requested.",
      "introduced": "v3.3",
      "last_changed": "v3.3",
      "superseded": null
    },
    {
      "ordinal": 4,
      "id": "received",
      "label": "Received",
      "occurrence": 1,
      "group": "causal_entry",
      "purpose": "Record when the causal trigger entered the capsule runtime.",
      "owner": "Capsule intake",
      "lifecycle": "pre_open",
      "source": "Runtime clock",
      "grammar": "ISO 8601 timestamp.",
      "cardinality": "Exactly one timestamp.",
      "verification": "Syntax and monotonic session ordering must pass.",
      "mutability": "Immutable after capture.",
      "hash_inclusion": true,
      "failure_condition": "Missing or invalid timestamp blocks schema compliance.",
      "display": "Internal; may appear in explicit capsule or audit output.",
      "introduced": "v3.3",
      "last_changed": "v3.9",
      "superseded": null,
      "notes": "v3.9 fixed causal-entry order by placing Received before Session Context and IC-Node."
    },
    {
      "ordinal": 5,
      "id": "session_context",
      "label": "Session Context",
      "occurrence": 1,
      "group": "causal_entry",
      "purpose": "Provide a deterministic, read-only session snapshot before intent resolution.",
      "owner": "SCF",
      "lifecycle": "pre_open",
      "source": "KV-Scribe TURN_INDEX, capsule ledger, active mode, mode history, and SESSION_THREAD",
      "grammar": "T[N] · CAP-[N] of [total_at_entry] · MODE · optional TRANSITION · SESSION · Thread; CAP-000 uses BOOTSTRAP.",
      "cardinality": "Exactly one value, maximum 240 characters; Thread maximum 80 characters.",
      "verification": "Compile deterministically from KV-Scribe; no local inference.",
      "mutability": "Frozen at causal entry; later child capsules cannot alter it.",
      "hash_inclusion": true,
      "failure_condition": "Missing callout, overlength value, inferred topic, or use as evidence triggers a governance fault.",
      "display": "Projected in the mini-map SCF line and available in explicit capsule output.",
      "introduced": "v3.9",
      "last_changed": "v3.9",
      "superseded": null,
      "examples": { "valid": "T[4] · CAP-004 of 4 · MODE: #mode_literal 🟡 · SESSION: EXPLORATORY · Thread: schema planning", "invalid": "The user seems focused and wants documentation." }
    },
    {
      "ordinal": 6,
      "id": "ic_node",
      "label": "IC-Node",
      "occurrence": 1,
      "group": "causal_entry",
      "purpose": "Resolve the active intent into entity, action, and constraint components.",
      "owner": "IC-Node",
      "lifecycle": "open",
      "source": "User Intent, Trigger, and active verified constraints",
      "grammar": "[Entity] [Action] [Constraint].",
      "cardinality": "Exactly one resolved intent tuple.",
      "verification": "Must preserve the request and respect the single-active-intent law.",
      "mutability": "May be corrected before reasoning; immutable once reasoning begins.",
      "hash_inclusion": true,
      "failure_condition": "Ambiguous or multi-intent resolution blocks reasoning until resolved or routed.",
      "display": "Internal unless capsule state is explicitly requested.",
      "introduced": "v3.3",
      "last_changed": "v3.9",
      "superseded": null
    },
    {
      "ordinal": 7,
      "id": "capsule_id",
      "label": "ID",
      "occurrence": 1,
      "group": "identity_lineage",
      "purpose": "Give the capsule a unique session identity.",
      "owner": "DEX",
      "lifecycle": "open",
      "source": "Capsule namespace allocator",
      "grammar": "CAP-XXX-DOMAIN-SESSION.",
      "cardinality": "Exactly one unique identifier.",
      "verification": "Must be unique in KV-Scribe and valid for the assigned namespace.",
      "mutability": "Immutable after allocation.",
      "hash_inclusion": true,
      "failure_condition": "Duplicate, missing, or malformed identity blocks opening and seal.",
      "display": "Projected in the mini-map and explicit capsule output.",
      "introduced": "v3.3",
      "last_changed": "v3.3",
      "superseded": null
    },
    {
      "ordinal": 8,
      "id": "parent_capsule_id",
      "label": "Parent Capsule ID",
      "occurrence": 1,
      "group": "identity_lineage",
      "purpose": "Declare the immediately preceding sealed capsule in the session chain.",
      "owner": "KRONOS",
      "lifecycle": "open",
      "source": "Latest sealed KV-Scribe entry; CAP-000 uses the governed boot exception",
      "grammar": "A valid capsule ID.",
      "cardinality": "Exactly one for every non-genesis capsule.",
      "verification": "KRONOS checks the ID against the latest sealed capsule before reasoning and the closure gate rechecks it.",
      "mutability": "Immutable after chain verification.",
      "hash_inclusion": true,
      "failure_condition": "Missing or non-current parent blocks closure under Universal Parentage.",
      "display": "Represented by the parent PoT projection in the mini-map chain.",
      "introduced": "v3.3",
      "last_changed": "v3.3",
      "superseded": null
    },
    {
      "ordinal": 9,
      "id": "parent_hash",
      "label": "Parent Hash",
      "occurrence": 1,
      "group": "identity_lineage",
      "purpose": "Bind the capsule to the previous sealed Proof of Thought.",
      "owner": "KRONOS",
      "lifecycle": "open",
      "source": "Previous sealed capsule PoT in KV-Scribe",
      "grammar": "Previous PoT projected to four characters by the current schema.",
      "cardinality": "Exactly one for every non-genesis capsule.",
      "verification": "KRONOS requires an exact match to the ledger projection; the closure gate repeats the check.",
      "mutability": "Immutable after chain verification.",
      "hash_inclusion": true,
      "failure_condition": "Missing or mismatched hash blocks opening or closure.",
      "display": "Always projected as the left side of the mini-map lineage pair.",
      "introduced": "v3.3",
      "last_changed": "v3.3",
      "superseded": null,
      "notes": "This records the current v3.11 schema literally; any move from a four-character projection to a full digest requires a schema change."
    },
    {
      "ordinal": 10,
      "id": "capsule_name",
      "label": "Name",
      "occurrence": 1,
      "group": "identity_lineage",
      "purpose": "Provide the human-readable name of the capsule and its reasoning event.",
      "owner": "Capsule runtime",
      "lifecycle": "open",
      "source": "Resolved Goal and capsule context",
      "grammar": "Concise human-readable label.",
      "cardinality": "Exactly one value.",
      "verification": "Must accurately identify the capsule without adding unverified claims.",
      "mutability": "May be refined before reasoning; immutable at seal.",
      "hash_inclusion": true,
      "failure_condition": "Missing or misleading name fails schema review.",
      "display": "May appear in mini-map context, TURN_INDEX, and explicit capsule output.",
      "introduced": "v3.3",
      "last_changed": "v3.3",
      "superseded": null
    },
    {